{
  "document_id": "journal-10-67-5-676-697",
  "source_file": "E:\\easy\\documentor\\documentor_langchain\\experiments\\metrics\\test_files_for_metrics\\journal-10-67-5-676-697.docx",
  "document_format": "docx",
  "annotation_version": "2.0",
  "annotator": "qt_visual",
  "annotation_date": "2026-02-25T07:29:35.705854",
  "elements": [
    {
      "id": "elem_0000",
      "type": "text",
      "content": "УДК 004",
      "parent_id": null,
      "order": 0,
      "page_number": 1,
      "bbox": [
        109,
        113,
        223,
        146
      ],
      "metadata": {}
    },
    {
      "id": "elem_0001",
      "type": "text",
      "content": "Давлетов А.Р. QQ# Principal",
      "parent_id": null,
      "order": 1,
      "page_number": 1,
      "bbox": [
        440,
        168,
        798,
        203
      ],
      "metadata": {}
    },
    {
      "id": "elem_0002",
      "type": "text",
      "content": "Software Engineer, LeetCode",
      "parent_id": null,
      "order": 2,
      "page_number": 1,
      "bbox": [
        426,
        218,
        763,
        252
      ],
      "metadata": {}
    },
    {
      "id": "elem_0003",
      "type": "text",
      "content": "(г. Саннивейл, Калифорния, США)",
      "parent_id": null,
      "order": 3,
      "page_number": 1,
      "bbox": [
        380,
        268,
        806,
        303
      ],
      "metadata": {}
    },
    {
      "id": "elem_0004",
      "type": "title",
      "content": "СОВРЕМЕННЫЕ МЕТОДЫ МАШИННОГО ОБУЧЕНИЯ \nИ ТЕХНОЛОГИЯ OCR ДЛЯ АВТОМАТИЗАЦИИ \nОБРАБОТКИ ДОКУМЕНТОВ",
      "parent_id": null,
      "order": 4,
      "page_number": 1,
      "bbox": [
        213,
        365,
        972,
        496
      ],
      "metadata": {}
    },
    {
      "id": "elem_0005",
      "type": "text",
      "content": "Аннотация: ежедневно выдается бесчисленное количество документов, таких \nкак заказы, накладные и счета-фактуры. Затем эти документы хранятся в корпоративных \nИТ-системах. В настоящее время технологические разработки привели к появлению \nэффективных \nметодов \nпередачи \nэтих \nдокументов \nпоследующим \nпроцессам \nв \nмашиночитаемой и структурированной форме.",
      "parent_id": "elem_0004",
      "order": 5,
      "page_number": 1,
      "bbox": [
        106,
        562,
        1081,
        783
      ],
      "metadata": {}
    },
    {
      "id": "elem_0006",
      "type": "text",
      "content": "Оптическое распознавание символов - одно из новаторских решений, оказавшее \nбольшое влияние на многие отрасли. Технология OCR была впервые разработана в середине \n20-го века, когда она все еще находилась в зачаточном состоянии. Ранние системы OCR \nиспытывали проблемы с распознаванием различных шрифтов, стилей и раскладок. Наука \nмашинного обучения и искусственного интеллекта модернизировала OCR. Сегодня он \nневероятно точен и заслуживает доверия. OCR — это мощная технология, которая \nпреобразует многие форматы документов в редактируемые данные с возможностью поиска. \nЗа прошедшие годы эта технология значительно продвинулась вперед. Она предлагает \nплавный и эффективный метод использования и организации огромных объемов данных.",
      "parent_id": "elem_0004",
      "order": 6,
      "page_number": 1,
      "bbox": [
        106,
        800,
        1081,
        1207
      ],
      "metadata": {}
    },
    {
      "id": "elem_0007",
      "type": "text",
      "content": "В рамках данной статьи целью стало рассмотрение современных методов \nмашинного обучения и существующих технологий OCR для автоматизации обработки \nдокументов.",
      "parent_id": "elem_0004",
      "order": 7,
      "page_number": 1,
      "bbox": [
        106,
        1222,
        1081,
        1348
      ],
      "metadata": {}
    },
    {
      "id": "elem_0008",
      "type": "text",
      "content": "В качестве методологической базы стали научные труды зарубежных авторов, а \nтакже успешные примеры внедрения данной технологии в производстве [1,2].",
      "parent_id": "elem_0004",
      "order": 8,
      "page_number": 1,
      "bbox": [
        106,
        1364,
        1081,
        1443
      ],
      "metadata": {}
    },
    {
      "id": "elem_0009",
      "type": "text",
      "content": "Ключевые слова: машинное обучение, ML, распознавание документов, обработка \nдокументов, производство, ИИ. ",
      "parent_id": "elem_0004",
      "order": 9,
      "page_number": 2,
      "bbox": [
        106,
        111,
        1081,
        190
      ],
      "metadata": {}
    },
    {
      "id": "elem_0010",
      "type": "header_1",
      "content": "Введение",
      "parent_id": "elem_0004",
      "order": 10,
      "page_number": 2,
      "bbox": [
        193,
        207,
        315,
        240
      ],
      "metadata": {}
    },
    {
      "id": "elem_0011",
      "type": "text",
      "content": "Машинное обучение представляет собой совокупность методов, \nкоторые компьютеры используют для анализа данных и улучшения способности \nпредсказывать результаты или вести себя в соответствии с этими данными. ML \nумеет работать с данными, поступающими каждую секунду, что для человека \nбыло бы непосильной задачей. Автоматизация этих процессов освобождает \nсотрудников от рутинных обязанностей, позволяя им фокусироваться на важных \nстратегических задачах. Процесс машинного обучения, как представленный \nКалифорнийским университетом в Беркли, можно разделить на три ключевые \nсоставляющие:",
      "parent_id": "elem_0010",
      "order": 11,
      "page_number": 2,
      "bbox": [
        106,
        265,
        1081,
        699
      ],
      "metadata": {}
    },
    {
      "id": "elem_0012",
      "type": "list_item",
      "content": "",
      "parent_id": "elem_0010",
      "order": 12,
      "page_number": 2,
      "bbox": [
        106,
        724,
        1081,
        1481
      ],
      "metadata": {}
    },
    {
      "id": "elem_0013",
      "type": "text",
      "content": "переобучения или недостаточной адаптации. Этот метод решает различные \nпроблемы, от фильтрации спама до классификации данных.",
      "parent_id": "elem_0010",
      "order": 13,
      "page_number": 3,
      "bbox": [
        104,
        111,
        1081,
        200
      ],
      "metadata": {}
    },
    {
      "id": "elem_0014",
      "type": "text",
      "content": "Неконтролируемое машинное обучение: Анализирует и кластеризует \nнемаркированные данные, обнаруживая их внутренние закономерности. Эти \nалгоритмы выявляют схожие или разные паттерны в данных автоматически, их \nприменение включает поиск, анализ данных и уменьшение размерности модели.",
      "parent_id": "elem_0010",
      "order": 14,
      "page_number": 3,
      "bbox": [
        104,
        213,
        1081,
        402
      ],
      "metadata": {}
    },
    {
      "id": "elem_0015",
      "type": "text",
      "content": "Обучение с учителем: Данный вид обучения находится контролируемым \nи неконтролируемым обучением. Используя меньший набор помеченных данных \nдля классификации и признаков из большего набора немаркированных данных, \nэто обучение устраняет проблемы нехватки помеченных данных и экономит \nресурсы [3,4].",
      "parent_id": "elem_0010",
      "order": 15,
      "page_number": 3,
      "bbox": [
        104,
        412,
        1081,
        649
      ],
      "metadata": {}
    },
    {
      "id": "elem_0016",
      "type": "text",
      "content": "Если же рассматривать оптическое распознавание символов, или OCR, то \nоно является удивительной технологией, которая преобразует разнообразные \nтипы документов: от сканированных бумажных страниц до PDF-файлов и \nснимков, сделанных цифровой камерой, в данные, которые можно редактировать \nи искать. Точные механизмы, с помощью которых люди распознают объекты, \nпока еще остаются загадкой, но ученым известны три ключевых принципа: \nцелостность, целенаправленность и адаптивность (IPA). Эти принципы служат \nосновой для ABBYY FineReader OCR, позволяя программе воспроизводить \nестественное человеческое распознавание символов.",
      "parent_id": "elem_0010",
      "order": 16,
      "page_number": 3,
      "bbox": [
        104,
        662,
        1081,
        1102
      ],
      "metadata": {}
    },
    {
      "id": "elem_0017",
      "type": "text",
      "content": "Давайте рассмотрим, как FineReader OCR работает с текстом. Сначала \nпрограмма анализирует структуру изображения документа, разделяя страницу на \nблоки текста, таблицы, изображения и другие элементы. Строки разбиваются на \nслова, а затем на отдельные символы. Как только символы выделены, программа \nсравнивает их с набором образцов. Здесь возникает множество гипотез о том, что \nэто за символ. Основываясь на этих гипотезах, программа анализирует \nразличные варианты разделения строк на слова и слова на символы. После \nобработки большого количества вероятностных гипотез программа принимает \nрешение, предоставляя распознанный текст.",
      "parent_id": "elem_0010",
      "order": 17,
      "page_number": 3,
      "bbox": [
        104,
        1115,
        1081,
        1554
      ],
      "metadata": {}
    },
    {
      "id": "elem_0018",
      "type": "text",
      "content": "Кроме того, FineReader поддерживает 48 языков, что позволяет проводить \nанализ текста на уровне слов с использованием словарей. Эта поддержка \nобеспечивает более точный анализ и распознавание документов, упрощая \nпроверку результатов распознавания.",
      "parent_id": "elem_0010",
      "order": 18,
      "page_number": 4,
      "bbox": [
        105,
        113,
        1080,
        299
      ],
      "metadata": {}
    },
    {
      "id": "elem_0019",
      "type": "text",